title,job_role,companyName,job_location,Job_Summary,post_date,salary,today_date,Job_url
Software Engineer 2- BIOS Automation,Data Engineer,Dell Technologies,"Bengaluru, Karnataka","As a Software Engineer 2, responsible for the design and development activities associated with methods for Automating /Validating hardware/software systems,…",PostedPosted 30+ days ago,?,2023-03-15,/pagead/clk?mo=r&ad=-6NYlbfkN0BdeCH3wzlYpD364Be5JbcCJKJ8S-TlvC_iwEgvLx09tUBe2prqhCP1yYc_3luScx6p_JXsY0uz1l0w6PbcYvBD42XJDFLVI-vtm1ivCkXHiCB0sNdowjXep6r1uXWziOJGJmLoPVjBHQk8qXs4T3uc7iDgMcUp8lYAGxD30fI7IzIvkyO2nIJS2GvatCft02JCG_FAhnBym8oiRdYVgizraN2d74Ri3TfxEZW8EuCCfpN7ACr8VIFAHw6qoNczUwkqpOC_UOsteUe1ULdR5w0eEqZiJ4iNeeKuq8yZa1wPv3TSgQSc0VJSA3D8xk1RPTCyLmGwMW7vLsWpxt35sns0RpJHiC3JAkIhgZguJ77NA9_GQmR5shHMobAYLmbWNOogf6IX9ZKmcJ6Z-HhpCvbsPkeKfY3Zza8P720t73ssQm6wqOBvYsukufQIp9n5DHerz__m2ExNSMsKpUMJzUotcU9Ac1Kfd7tbZb-vNvStM1pLFBQXYj0sVeamQeInqsg5ghNfNMAoablSx20r5sABIEtX_vHMMudHWr_Z_wNwVxiNXTEK2kLItqRqoJzEqX4qBS-tnlRhxC58MdSLRBSVBmOmQYdGg6RQxSHR4kJ7823ukUYS9qs3TI_bIqM4IknRON8ANZXGjC8je7HBM0uYjCvcqyvFZEk2LycqKFu89WQhufPk_kumSoi-Lk571xB4_gETGg0prnpXgsLBL5f-ylSeJT_mxZvDCVX82OKYj7B8SfRtpZHdzlGLBV_1x76pjz5DbjRO9bhcC6t-x0xmBb76okjiOEbXZSqOiKeY21FdO3P8TqZMmL7KbpvSUkkBX6zb9DADU3DEIDqijEHaWmxQV8t9pv0qHSXEoN-WdoYKoCamLzIYOAOa1eksS-VmmI01S0kvCOVkRc4UqDSJKGj5Gy_xoyqEqlnijazdiybyyAyAuxE8IAJvsa1tnzNZZDTyvhUKx24xRdsv01WR4KSmrPwuRG85aMzO-YJW9CpncsjkkNVoFQc1EmzqsFGraNqp3s5C7aAaV7V6p_XlfOzF6_3v8KzDK6abFHADKGeQFNwYyP5LS2pfFLWLSJWh01k_gL7I38DW9OJUdRmDJfpMEBszwu22iTSKRP8b9JKb3DAyiz3uAefUMzfhjF1xagI4lHZj4L6urLnsSFb0f87H-UqJNQhgIkYBDrjKLNRQjtirEdS5huyVU1fOgrXqOCd9m6Q9Rz73HeRp9rQg&xkcb=SoCF-_M3SyqrBTSFhp0JbzkdCdPP&p=0&fvj=0&vjs=3
Broadcast Engineer,Data Engineer,"Conference Technologies, Inc.","Pune, Maharashtra","Key participant in business development including RFP responses, bid interviews, and engineering sales calls with potential clients.",PostedPosted 30+ days ago,?,2023-03-15,/pagead/clk?mo=r&ad=-6NYlbfkN0AiNMvsi1d0NtjZYREhIAd6FHX2DLU0Qp6h76bZjiVpNzbqJrYR1nNUcDWvI9hNhJG2zbz76Atif205FauDTekGxdZ9EUhN5zvBAlu3rHUrNnglkgiLsvbm-mDJroWTg_dBBS8Ik4qqzxKOIQK0iFeNwFTg3Sddpc5Rs1ZKsqscc8NHdlr81C3_3hYzNTB-J0Oh9rj4yFvOKu0PnxIrwk6EkKBP0TTseduTBZplto3sUdfwC8hm8nI0ItYoTvGcx6G6NnXOEKIDM47b9yvBiSbnfvPugNkVtNnNLYjPXsoI8pCmI7pjGmwC7HZNcpyNNlrEM30tsy6J5m_cQu7bDXzj-b-Ca_01RBnmnlYtgMPA4JtdYr6CrCoSKF60k2qJAT_tNMjZL9S6HWzmQRFwbpuYlIDP5k1mDsL2vySgIJ06QYkHOT-JQ-FBmAmGGek1u2rhMSamOKvOn4UXlDlLP-An17p5VBv_oXghMm3B7TAPCvZEKY1dT66-K_Qh8SRLE3UirCF2NcC7qBzrAWLcxiaH&xkcb=SoAx-_M3SyqrBTSFhp0IbzkdCdPP&p=1&fvj=1&vjs=3
Software Engineer,Data Engineer,Clarivate,"Bengaluru, Karnataka","The team consists of 10-12 engineers and is reporting to the Sr Manager.
We have a great skill set in Spark, Java, Scala, Hive, Sql, XSLT, AWS EMR, S3, etc and…",PostedPosted 30+ days ago,?,2023-03-15,/pagead/clk?mo=r&ad=-6NYlbfkN0BUkGQXKvz_vqTVnr0Vn5RYEtDOUY0w86cUTSPT2moMg1hz6LtadXLtghczIzGeDKg9857LlF8_hD-w2Y5UT8DlbwtPCegZ2uZZcdZN3n_0MHkRrRNGxhB5rpwa826CDw5adlsO0g_YHdoT4xDi18LMKnO1ICk92-SrOeaSGjFse851_US1JgU5WY2vgD9EgXYm6tJ7HKH6bhvkFJPyvXUS8teHTR9nYJm1lF__WLLkgOiZMIerQssfuch8nwcAB0nYZdCUGiiIGEcAhcP0JOoBAqqHBZ1tcFtDygSbtG4wacd7sfTJ41t9XRsnBndKlQk7DUHxn8PeRnJzJDcnuHULJdtcXj23j6CmTt2FAh6GRaUclcxdAWdPOrNi2iSjLP13rA-E-eV2mzAZR0QrcLtlNPwlx2hws0DfQRo5Kj3xSPAJ92JdWyrI0Ybx4lTKg-fzTNk2AFj6IZaRTKoVKHfEQ-W8WN6EEy9pCvm5GhWHxVlKxUNQiHEruiIN1LLZRBs0DxnAf3_-BRWzm68jfkuHvsgKc3nDR57iZLA7DYAVF28ADEhkA4E1weOQmD_y5KiyTNjAPAKM5rDyo82xowh0e_aZak3LMK8c_g8mvDhvfup7kdnVdgxN&xkcb=SoDp-_M3SyqrBTyFhp0LbzkdCdPP&p=2&fvj=0&vjs=3
SR Mulesoft Engineer,Data Engineer,Giant Eagle,"Yelahanka Satellite Town, Karnataka",Work on problems of moderate scope where analysis of situations or data requires review of a variety of factors.,PostedPosted 13 days ago,?,2023-03-15,/pagead/clk?mo=r&ad=-6NYlbfkN0B9Z5kUrYpJSl1jY-NmjPX7HlwbyZlOtE5lNuYxyWYp6wH4w4oCjnyWj2mpoyouuSa9sc9gWSTtJ0GCuCF597n7qWtncdSiCvSJzFyxymL3k6tJ7gIRD13V-pL17RP2ra3zlXCs09mHKMmcaHLdWBHX7_ZV0njopUD7OWKx8Dgwyy0KwzCikznwA1oxh6IToJOD1e5i-jZ7dNRiOpKIHVeve1Ct5K-WLTq4bXtzqLLOERX-0mZy1OAjGJfXc7NT381U5FPD0BZg5u2mc1LlM3P0Ph8C8B980p-YvV0Ww0CysnWrCCJRU6dAZ6NsDV4MSPkzYZ0e07HGeXhuvHrw_-nb3BHOS1klpAKMmKi61ndtR4RYRUS2diCAwNl5sp3vNvP-IuPjrRcYEpJPYiOPcI7VxZHiScMI139u2-GmzwLDQy45txgQPhLhkOKnDI9f3nVh7nMXnC52p00uUeK-T-8GEFvFCA7l6V9vRm_ylVW3LOteLBtmvw8HFsP4Kp9OwdVQO1jA7imF885RswqPnMzAsUcrbcov-OM=&xkcb=SoBd-_M3SyqrBTyFhp0KbzkdCdPP&p=3&fvj=0&vjs=3
R216181 Manager 2 Software Engineering - Embedded Controller,Data Engineer,Dell Technologies,"Bengaluru, Karnataka","As a Software Engineering Manager 2, leading a team of engineers responsible for the Embedded Controller Project.
Should have strong development fundamentals.",PostedPosted 30+ days ago,?,2023-03-15,/pagead/clk?mo=r&ad=-6NYlbfkN0BdeCH3wzlYpD364Be5JbcCJKJ8S-TlvC_iwEgvLx09tUBe2prqhCP1yYc_3luScx6iYWSxaefqm8ujQpxOLg7JNkfROIqc-3ZGaQaNSVMe_J-kHc0YJfFd_jGuJHBgrWjkjHwGJs5aGlULW-4ujr0fDFHACqspKcaprUZgIXt57acmvAXKN4LA1lKCEMHX2tUO_K6BvdTeNgdF7qB8ZonzhZKJgpXHWXTvsfkHoKftApdzZkjw-z3QtFFh7ui5sSsfAUv3IPBux6dGsRM4i3vHjxMkIOSSD8bOn4xdE9Oz6Em6_0I7Jw6TAAYeOSTBmgVPTeCa6Zp-NkKNN_6bxPwkoDcwp-IjxnEKktVB34ndCqu76QD7d7owtF9vO8qH_Au_bM_mZenjoXUKrFQ6VxxuhwfunSccU6sjfZNic2oAhPkerD5j81PNFGQhGffeoMziOK3NrMkX6M0l2UNioZd5jmIKQsiDAHMq985RApBpNAK9TprsohBvvPYqmZoYQFhSwWVF8Z40xcg6FBRmpC6XdaBiAvSa4907j6FnVdGNS2DCLx7593pdAUrjmPAlQkW-NyFvLC5ac0H_D5iCCiboghGEGmyVeyQ83KnptHJ_wb4VD7r12mhZGe_fl3RZoA_uJOQRIsiiGbROciLZTeIAxXyOdJIY1JhKDt2tba0LlvOxVQq1j59Zhm9H1qxLba9q0t_4n7TC5zNWJ9vBSpi3GH8sv-wSdH69y-qJrJ1Ns5DwjajADpKuD6GikhCc1wMFkd9J0ZQ23AnuIIS0zsOrG9k45fJ9jJxIpYcMVBFy1Ig2k0Z5zeou2-60PcySy0jIsCb1PLwoNJm6_Xm9hRvpjJfhMrmeKElAKmzKxczbSw9AChKEDiSeKsRuTJ00rnLWQCkC-tY7Pcg95mnvydkatreqacWVgxfNda5ihsCjm4x5acOnIN50iFaPcC-QYHTWgsknIOf5jYJpbMbntd1qzXaLdvB2_-1tXHgmpYtP99h5b7TpTfFwwzrzI3GyTRuDDlF0iyHDmv_K997Pznu3J-j_oup9lFXaO2l2O1JjJCb1f-XPSTjpW0vXAQ_qqplBwc7O3uedRsjZBi6brHNP61fgqRUnTUrRnamsWDohCU5beJxRRJj8d8bzwqH91e1KR5SaGHUrDJVq41P8mh8NcpnVJ_AIPU5UNOBKTFvfphVwu3SdLx0y60S2j1YBz-Zac51ghpqJwW-tgcxV-9to&xkcb=SoDA-_M3SyqrBTyFhp0JbzkdCdPP&p=4&fvj=0&vjs=3
Data Modeler,Data Engineer,Giant Eagle,"Yelahanka Satellite Town, Karnataka","Provide technical leadership, mentoring and training of existing software engineers.
Enables us to expand internal capabilities in the areas such as data…",PostedPosted 12 days ago,?,2023-03-15,/pagead/clk?mo=r&ad=-6NYlbfkN0B9Z5kUrYpJSl1jY-NmjPX7HlwbyZlOtE5lNuYxyWYp6wH4w4oCjnyWj2mpoyouuSbZu4ZoFViJFpgbvVRfYKp-yAzmA4B572gxQrPQTNWbXMTHfIo0-K6meDlID-_siVVVXMtLZCdZzOHGjnzCF3egjZGAzvAaU8vMjle4W1tTocmOYWHVsVQTtA-x9zNz2If0h5Rl103Qc7KLdO4uHVue_zFHwxBj_5aep5fwZ0CZSPYalzS5PqDPsjAXEYHsz-fcww6oRTJWU0TpfyffAAhzJXILoc99fBAQdYQlIU5c4TS_heGo6mhtGpU4sYtYTeYTcEUToFJN0ZmeilmHaXisM8TnInvx0b80vy0iot9-mUiFyeblMy_pr6ekVRdZZh0rinpGoFSPw0Xivm3mG3ZjSQ14XulBP5Ps5-fevI3ZbRHjjoSynHU5phQYu3_4DnZA4vshPo9nTWcwvAqqv8lH6H97Pk7htGwZNU9TB7WP2if0nlJC89Mjy_fWt2TZl2po-262lPcsAx6eAE6ERxsZ0Wdv45aPMAY=&xkcb=SoB0-_M3SyqrBTyFhp0IbzkdCdPP&p=5&fvj=0&vjs=3
Computer Science - online tutor/expert,Data Engineer,Chegg India,Remote in India,Anyone looking for IT Consultant/Cyber security Engineer or Cyber security Consultant/Information Systems Manager/Database Administrator/Multimedia Programmer…,Hiring ongoing,?,2023-03-15,/pagead/clk?mo=r&ad=-6NYlbfkN0BBJGzQ3pZDDCAurZe0N9GWXS38iI_dIqspGlSJHY7voQrVdbngFuoJCkBlWJBtFeQCW6dmOHSrKMr95EaxIe18PVisEew6mc30CKO9ssAQvo1Vc3lZZu0kY6HwYxWqeaXi1LwzUaOH_RkHDvsa_-uhO5CdSdLMajQDZ3E6Z6DFsHeoMJZYujak9e2gaWtlU5ymp_n4vJTORD2pkdxreWJFErJ3IsNpsdNF0pxkXOnWekQ6wT3omjSw86bDJIGNma0HGLkj5JaXJdf7bkAMVWuyGjOqsBethLaFQh6cSOV_BrFICwtHu-C2Xkv56qvS2dvCLT_VbiWXq9G4DBuK53SrYe8tavfVyuZB5PpCh0ANIpC4fiV2sRFafxO0hSXJcZRC55oF7XsbGMOoUaIFDjNTaJDJ-6uc6dUQ91eJ-WbcJkIXOVmQCqiH79UjCXEsJhy-5DGJ7F1PjMp1kCqNGFYUpBZlnBKdpCSAc6OdnXFYyTgdTcsIokQo2mGYopUY9q_v854iJb8bvtFnqPxa5sANJu7XQmuonOY4qBQOdZ4Yt2jCOmzlWL9fnqt9OjcZLxZAfCTcguSsYLISWcwW1JZCAzCck792Xs89P65hliY8VYd7wm_8NE7w&xkcb=SoD6-_M3SyqrBTyFhp0PbzkdCdPP&p=6&fvj=1&vjs=3
WSO2 Engineer,Data Engineer,Exaze,"Hyderabad, Telangana","Work closely with Business Analysts to analyze and understand the Business Requirements and Business cases, in order to produce simple, cost-effective and…",EmployerActive 2 days ago,"₹8,00,000 - ₹16,00,000 a year",2023-03-15,/pagead/clk?mo=r&ad=-6NYlbfkN0DXaHWapi88SlLW5qoLM-SVTAyjQRaSbppsfhqX3YVgp_Ju5ne8qzhq-JKiWgVUWZwyUeXsTpyR5U_R3B-mubj-zsr_FhAaFikOoOc2uCIoZLuoz9IJfeXwqTRkpS44ExF6F6623im1bE8IIAOsiWV_6EDEB8Z4LZmraJ1d5PUy8yWIWh2NpNqjPbFzF-LYPJsS-kzZt2a3FJdI-geXUeKnjg84iHCw8sVkqms_RS1JjATRJPKHvHBqAywhep2-Sj1Hw9KCpPeJ5HilaVbdIQ9CtzND5r4wFdzIQxSiKP4pfwt2_hPrVgX1ibkLqHZxfntwP6MzeCsXNPjKBwtPxFRht6MS3HLN_rl1tvZ46d9zT8G4jOw_VmDUYDLguS7WGGXVI6uq0q4Dfzrp6JRT72260FGFhcyxjuSijE34tySSgV9RQxqt3UYa8xZXiue2eG_OvFfGSkLt548xyHJsvVYqnVlUMQyAuTKQpH8B5htf3sq9r6o1kHXgYrj0qx6EdeKwE9jJWAFQblsNCSqN32tQW3-Jua7AJWY=&xkcb=SoBO-_M3SyqrBTyFhp0ObzkdCdPP&p=7&fvj=1&vjs=3
Sr. Data Engineer,Data Engineer,Genworth,"Noida, Uttar Pradesh","Proficient in Cleaning and structuring the data by applying feature-engineering techniques.
As part of your role, you will be responsible to develop and…",PostedPosted 30+ days ago,?,2023-03-15,/pagead/clk?mo=r&ad=-6NYlbfkN0DveHtaohNZTTr4NJ6iQ6LvBAugsddynFItxJfHbw6F-KCCBzz-kRnWozZCoRv0wg_W1ImkkiWNPY_DwF-HpEbgTTd_jI1zwdRg2KDoujy2fIbIYdi-kBUUom9WbC-x4gF2T0GwFMF4Wm4ZShKF_ywjgWUYf7CQl8sThJiv0iLltuGQarLKRwiZlEgbY01UqJyLcbHTnLc20G9FEttHe6nYUkrNAGIk9jrzUO6byb5AKwTxPpM7FI2yFVJJr5Ln4_bKjWBR3-w18BkvsY3kKbN6Hg5y3EyV0XkSP26lOyd1-uH2LI0hVCo_l6ZXPni8E9leitVN1aaujrpMKe_nCtCxaFFLB5WJ3tHi_QsA7-EdC3Lx8jqKQLAWXXlmaVGbYipLkYXDxdTTPtZesljbyyzVR9KMNvI5ycJtOJu0pEabD2kMIGApR34slAqWQz-lX9lWqOchKA26ykGVR60N3_hmkoyDTXcjVSgPqKwsox5bikj064Px_eXhZSFJ8q5XALu1m2oK40U6PGHXpYitAVO5nhunOCej_PYZl6j7ot8DXgU5qNBSTB-Ets9zh1BiNkY=&xkcb=SoDT-_M3SyqrBSSFhp0KbzkdCdPP&p=9&fvj=0&vjs=3
Data Engineer,Data Engineer,Global Employees,Remote,"Passion for engineering and computer science around data.
Increase accessibility and effectiveness of data (work with analysts, data scientists, and developers…",EmployerActive 1 day ago,"₹10,00,000 - ₹30,00,000 a year",2023-03-15,/company/Global-Employees/jobs/Data-Engineer-20ffa9d0a016398d?fccid=0a420069a8b9978f&vjs=3
SQL Data Engineer,Data Engineer,Smart fusion corporate solution,Remote,"Immediate Hiring!!! Salary : 400000 lak to 1200000 lpa Experience: 2 years to 10 years Contact: 98847 00289 Job Type: Full-time Salary: ₹600,000.00 - ₹1…",EmployerActive 1 day ago,"₹6,00,000 - ₹12,00,000 a year",2023-03-15,/company/SmartFusion-corporate-solutions-pvt-ltd/jobs/SQL-Data-Engineer-fbeee3679b25712f?fccid=15f83df41eaacd5b&vjs=3
Data Engineer,Data Engineer,corioliscontinuum,Remote,"Responsible for the conception, design, development, and deployment of data architecture and data models.
Ensure high-performance access to diverse data sources…",EmployerActive 2 days ago,"Up to ₹18,00,000 a year",2023-03-15,/company/corioliscontinuum/jobs/Data-Engineer-3d9000ebbb30f28f?fccid=53b1f04fad3839cf&vjs=3
Data Engineer - Jamaica,Data Engineer,TheHive,Remote,"Assess data to determine strategic approach to data management and identify data dictionary.
5+ years of experience in analyzing and preparing data, including…",PostedPosted 27 days ago,"₹1,24,237 a month",2023-03-15,/company/TheHive/jobs/Data-Engineer-98deac5b4fdb8fb2?fccid=3f6264f8e7e6996f&vjs=3
Big Data Engineer,Data Engineer,Albireo Tech System,Remote,"Skills- ETL, aws, sql, kafka, spark, dynamodb.
Time - 30 min to 45 min.
Job Types: Part-time, Freelance.
Part-time hours: 5 per week.",PostedPosted 22 days ago,"₹1,000 - ₹3,000 a day",2023-03-15,/company/Albireo-Tech-System/jobs/Big-Data-Engineer-b55841737f9dd282?fccid=4495f8b04aecf27d&vjs=3
Big Data Engineer,Data Engineer,Albireo Tech System,Remote,"Skills- ETL, aws, sql, kafka, spark, dynamodb.
Time - 30 min to 45 min.
Job Types: Part-time, Freelance.
Part-time hours: 5 per week.",PostedPosted 22 days ago,"₹1,000 - ₹3,000 a day",2023-03-15,/company/Albireo-Tech-System/jobs/Big-Data-Engineer-b55841737f9dd282?fccid=4495f8b04aecf27d&vjs=3
Integration Engineer,Data Engineer,Uber,"Hyderabad, Telangana+1 location",The Integrations Engineer will work in partnership with cross-functional teams to define requirements and ensure the seamless transfer of data within our…,PostedPosted 30+ days ago,?,2023-03-15,/pagead/clk?mo=r&ad=-6NYlbfkN0AVIi8UxprrPGU7QPohOxOOpynq0pcPnEidcD-eE3H2SscmD_E2BRcx7-dx3BBatDlEuJwH3eeDUJcjNkN5TgxQEm-1MMO3bMRUWmWTpwm9-QazF67L_CwaW-t9CBnSRemI-qds0-vDmmZlV4sL4Ep9IF4sUetJM1erV8aN9Z7dK9JtvhXc7CqdBl6qdFX5KiypxC7fwlAYgZW36MDbL7x1s7LpvRVsH-1RlwpjzNimmddpoEHXCK7dRxapLe8U7mpRXMnIldDtOFqpdf66TowCmT7Aykm8cVDWkuiPy-jxB9efK9drDDZBse1A0fa2mkSU9rkNGiqyZj49-Hilm9P4hx9SB8rSO__M05U3l3pTdDYnOZd3A_ajS1kI3oVnUgUyQEdjk1JbKaicS4JNPAkZWIV673jRfOYzr-6JN8etSq7C9of9vfiLTLCZpxTQSvDGe55JapLBSjG-gtyAN9VEazUlc5ZakZolpkqfZqynULnHMWOXCYpHOfo9PSxI5rWIdOZjy9SiZSsrQrwf3aidF1RrjhogdpL3vHmh0hlwOE_1L59GT59e-UwiaXO_KvewyvZRQ7PKRWdzSeM-0VHuEgTezXlrTj2w44EO671BlzjblR-f2mCVOeIf4mqq7RhIiEmTCnv569rPJiKrU7_y3l5PsDvlAE9ljnPTKan-1lTcpOHm-h1AG71ydfFUdxdjPX4TA80Faed62I48zIb6Wzh1Xn5qWnA3P66mZiZVGmeh7SEdcgTbi8Widd3QIiyY6X28ovGs2Ri29G48GI4T2BgHbz6-nFUTEZpInie1_d5qUN7HIUvYwdjQBFvxWA6YA2Lk4jySJKFfLBIkzIvVXvDZtTdYBuufeEZK1QHh_jhkmgijryLL4yYpbEMaoBCsOAsNyD8Z1ekWjGd24QZssU6kqqQGB2gcfUHb3OlELnv3jAJF6vYv9cOVdC-EZ02CJU2BkbN3OVommrTr8PWEBnKDGoZi27VhRF1tzUUWN6k0KOwCuA8hxs5XhOS3AJSuuowDCSlbag1OkX4_jleYBKn_02jbMmXcrTPWeHGKu19iicu95dzA6JH5fXlF7bpFxk3E7ITPCt1vEaH9TvQbt6gY0dzV4Lhde0_GV4zdOz_wH0uSvFLtjTeaB2dMi5BhUzD3qEieQEuKgUwH4Almh5rFiaX242kIm20VLdCZ_g==&xkcb=SoDl-_M3SyqqRpyFhB0IbzkdCdPP&p=1&fvj=0&vjs=3
Network Engineering - Engineer,Data Engineer,Telstra,"Bengaluru, Karnataka","Previous Cloud and data centre operations experience.
We are on the lookout for a capable technical IP network lead within Converge Core Engineering (CCE)…",PostedPosted 11 days ago,?,2023-03-15,/pagead/clk?mo=r&ad=-6NYlbfkN0CdG0mlcq8sM0kM4Z0XjE22y1IvS4TfdSBI7lJNBQS5z7JpQ3_4tlP2Z1SxCDGvrdnC9Y0WD6d1sOfLsKXusBgEDCFPRE9Dg1kpaNlU8jvkJFFL3T0yPUDTCajQFc-GdgTuk_kWQ3MLomeMLhQCVwk1d5qKjX7Swv44D2aTFbvl0vURizixplHcnp2fdH85oOSDTrWZ_9Hc0N4yoDoJFRGxvS_NqLZ7166hN-j2tWFHN2VctEstioYK1NYcGnl_EFJMZGxC1pJmEOOkmKKnnZ8WL-mEkR8ahnNexGpl3uZsV1q4vBa2g9jdbMJBvLnyRvGXlugR1uWOno7jJHBR6j3Dvl0BX_q5uNSKuE4KRM1m2MqogXgccmkD_rmGiLPeICGBOWv8SDDtV7mRFVh9YStzxprp0fvYSFVGSppJX6Jjn5tYdzKiwSlApa__7ttRZssdC2HIbq620gKeV93TTnTsmYE4uxCk4FEhK5A-jJzdVe9P2OV8ePo3JBFy1W9T4SthWeO1QnoC3DeIuRaFBD8lS5H71CQTPF-RiwYCJHN_oMm8MoBFPGZArLnoXhd3EOFyMkXwHOFOMdOHATwQqZ9iYWdpLvOJwefOu3yZxPOftMKHG59UcHuvCcEMfN5Rsvt4r4wTKbAcbcLzIt4kyiWwGTbAZBW0KlotsunykE3c3A==&xkcb=SoBr-_M3SyqqRpyFhB0PbzkdCdPP&p=2&fvj=0&vjs=3
Data Engineer,Data Engineer,corioliscontinuum,Remote,"Responsible for the conception, design, development, and deployment of data architecture and data models.
Ensure high-performance access to diverse data sources…",EmployerActive 2 days ago,"Up to ₹18,00,000 a year",2023-03-15,/company/corioliscontinuum/jobs/Data-Engineer-3d9000ebbb30f28f?fccid=53b1f04fad3839cf&vjs=3
Data Engineer - Jamaica,Data Engineer,TheHive,Remote,"Assess data to determine strategic approach to data management and identify data dictionary.
5+ years of experience in analyzing and preparing data, including…",PostedPosted 27 days ago,"₹1,24,237 a month",2023-03-15,/company/TheHive/jobs/Data-Engineer-98deac5b4fdb8fb2?fccid=3f6264f8e7e6996f&vjs=3
Data Engineer,Data Engineer,krtrimaiq cognitive solutions,"Bengaluru, Karnataka","Krtrimaiq Cognitive Solutions appears to be a company that offers various cognitive services such as natural language processing, speech recognition, and…",PostedPosted 23 days ago,"From ₹50,000 a month",2023-03-15,/company/krtrimaIQ-Cognitive-Solutions/jobs/Data-Engineer-8250bb321b895226?fccid=d3aa50321d9819e5&vjs=3
Data Engineer- O9,Data Engineer,Acies Global,"Remote in Bengaluru, Karnataka","Passion for working with data - data processing, data storage, data visualization, data quality, data infrastructure, security.",EmployerActive 1 day ago,"₹10,00,000 - ₹20,00,000 a year",2023-03-15,/company/Acies-Global/jobs/Data-Engineer-0c324ad6572b6367?fccid=b791e275e2e14f3d&vjs=3
Data Engineer,Data Engineer,Mercedes-Benz Research and Development India...,"Bengaluru, Karnataka","Work on Cloud/MAPR based Hadoop systems and build various data pipeline, data algorithms and processing solutions and provide insights.",PostedPosted 30+ days ago,?,2023-03-15,/rc/clk?jk=417661483bdc6899&fccid=9ab138c02aaca829&vjs=3
"Data Engineer(Python, Scala, Spark)",Data Engineer,knorex india,"Remote in Pune, Maharashtra","Good knowledge of algorithms and data structures.
Minimum 2 - 5 years of experience.
Must be proficient in Python & Scala.
Experience in Spark is a good plus.",EmployerActive 5 days ago,"₹3,72,169 - ₹16,31,390 a year",2023-03-15,/company/KNOREX-Pvt.-Ltd./jobs/Data-Engineer-9c77785a903d00f7?fccid=176f2a6b19413728&vjs=3
Data Engineer,Data Engineer,Oracle,India,"Responsible for managing a growing cloud-based data ecosystem and reliability of our Corporate datalake and analytics data mart.
Ability to travel as needed.",PostedPosted 15 days ago,?,2023-03-15,/rc/clk?jk=7438116928cd21de&fccid=cd22d01053af7669&vjs=3
Data Engineer,Data Engineer,Arting Digital,Remote,"Ensures data solutions include deliverables required to achieve high quality data.
5+ year experience in coding for data management, data warehousing, or other…",EmployerActive 22 days ago,"₹3,00,000 - ₹15,00,000 a year",2023-03-15,/company/Arting-Digital/jobs/Data-Engineer-a483a93f21c42990?fccid=4e7f568d250cd695&vjs=3
Automation Testing Engineer,Data Engineer,Impetus Infotech India Pvt. Ltd.,"Temporarily Remote in Bengaluru, Karnataka",Our products and services are designed to empower the real-time data driven enterprise to help our clients win in the modern world of digital transformation.,PostedPosted 30+ days ago,"From ₹3,00,000 a year",2023-03-15,/pagead/clk?mo=r&ad=-6NYlbfkN0AGEVbZ2_EvqOrNbUUcdLvwezuoK2AEzvuLfn6UI04WCipH-fDPeMV5RkEJh0bkYz4YbVclcMIAO3dA527qWGRoJgFI2cuKv4myCelNsoRSxRdq1cn9S5lGG4BE5CXHJIfVEICt2anW-LK3cEcfux7nmKgqrG733PFVEuUYfXciHQmTMWC5uXq2iL0ZrUdtAxwR9GErx9zpyjup5M4hcBklIy5XaflmFm9TLv8vagwvYaF209TfcE-PuTilUFPvTgevmg_b3VtzY7p0j6d3NXYFTkgiM0JcPlsW-1NDwy1QoxzD7yIYXLT2nPPvfM0udZARpGXCeXeQa7-Ec3BIRIkd91Dw9wab0ryD0GsbUhkLP164nkOaZj1AFJuuXfd6ZZf0jC1KhrFlzjJjySr-JZHdB2dED0Vki8xGHdz39My6rYe3-YR48OdQriOdsC-gI8sDX5MY6HlE2EhF1kQzPJjlqa70UeYfJfrB7efNfSp7gFWOYlDpVeiskxAJzq9yFEZtpNQn8n5twL_bnMPdA9TkE_DqkRD7L3WWGm58mQ4O_Q==&xkcb=SoCz-_M3SyqqRoyFhB0LbzkdCdPP&p=13&fvj=1&vjs=3
Junior Data Engineer (PowerBI),Data Engineer,Anblicks,"Vijayawada, Andhra Pradesh","Expert in data modeling and design standards, tools, best practices, and related development for enterprise data models.
Azure experience is nice to have.",PostedPosted 14 days ago,?,2023-03-15,/rc/clk?jk=bc7cf75ef31cae09&fccid=e0efd5c38293090b&vjs=3
Azure Data Engineer,Data Engineer,codersbrain,"Remote in Bengaluru, Karnataka","Azure data factory: 3 years (Required).
An Azure Data Engineer with over 3 years of experience in the field.
Hadoop, HIVE, Talend (Experience in the past).",EmployerActive 2 days ago,"₹15,00,000 - ₹22,00,000 a year",2023-03-15,/company/codersbrain/jobs/Azure-Data-Engineer-35c8da7a904118a8?fccid=528bf56140d22120&vjs=3
AZURE DATA ENGINEER,Data Engineer,Kovan technology solutions,Remote,"A. Should have experience implementing real time high throughput and low latency data.
Solutions using Azure Event hub, Azure Streaming and Azure Cosmos DB.",EmployerActive 1 day ago,"₹70,00,000 - ₹80,00,000 a year",2023-03-15,/company/Kovan-Technology-Solutions/jobs/Azure-Data-Engineer-90cdce8668f815f1?fccid=c075b221abb36ec0&vjs=3
DATA ENGINEER (DATABRICKS),Data Engineer,WARPE TRAINING AND COUNSULTING,"Chennai, Tamil Nadu","Understanding of data architecture and design data solutions across all systems.
Contribute to the design, build, and delivery of data analytics platforms.",PostedPosted 12 days ago,"₹9,00,632 - ₹22,29,561 a year",2023-03-15,/company/WARPE-Academy/jobs/Data-Engineer-0c81fe2be0bb17b1?fccid=c5ac32afcebdf0b5&vjs=3
Azure_Data_Engineer _T8,Data Engineer,Mercedes-Benz Research and Development India...,"Bengaluru, Karnataka","Good knowledge of Spark and Scala.
Good knowledge of ADF and Databricks.
Strong communication and interpersonal skills.
Good knowledge of Spark and Scala.",PostedPosted 30+ days ago,?,2023-03-15,/rc/clk?jk=ff5f814d2d1f929b&fccid=9ab138c02aaca829&vjs=3
Data Analytics Engineer for ADAS Development,Data Engineer,Mercedes-Benz Research and Development India...,"Bengaluru, Karnataka","Development of Data Analytics algorithms for gaining insights in ADAS vehicle measurement data.
Development of Data Analytics algorithms for gaining insights in…",PostedPosted 30+ days ago,?,2023-03-15,/rc/clk?jk=e942c49868f8d28b&fccid=9ab138c02aaca829&vjs=3
Sr. Data Engineer,Data Engineer,Lifesight LLC,"Bengaluru, Karnataka","Design and implement data management services for data trust, data compliance, data access, and metadata management in the form of scalable and configurable…",PostedPosted 9 days ago,"₹20,00,000 - ₹40,00,000 a year",2023-03-15,/company/Lifesight/jobs/Senior-Data-Engineer-4283a3813b03c42a?fccid=407b9c1148c53091&vjs=3
Business Intelligence & Data Engineer,Data Engineer,PBI Analytics,"Remote in Mumbai, Maharashtra","Structured training for graduates to become Data Engineer and Business Intelligence developer.
Power BI, ADF, Synapse, SQL, SSIS, etc.",EmployerActive 1 day ago,"₹1,20,000 - ₹3,50,000 a year",2023-03-15,/company/PBI-Analytics/jobs/Business-Intelligence-Data-Engineer-f699d2bf1bb91c62?fccid=d4aa60902c812037&vjs=3
Wobot.ai - Computer Vision Engineer,Data Engineer,Wobot.ai,Remote,"Work Actively as a part of the Computer Vision and Deep Learning Team to Train Computer Vision Models.
Work Closely with the Data Science Team for Appropriate…",EmployerActive 1 day ago,"₹5,00,000 - ₹8,00,000 a year",2023-03-15,/company/Wobot.ai/jobs/-e15993a2174fc171?fccid=8363f2c75e626c73&vjs=3
Data engineer,Data Engineer,L&T Technology Services Ltd.,"Hyderabad, Telangana","Mentor other engineers, with sharp analytical abilities, and proven design skills.
Secondary Skill : Unix & PL-SQL.
Awareness of AWS ecosystem is an advantage.",Hiring ongoing,"From ₹90,000 a month",2023-03-15,/company/L&T-Technology-Services-Ltd./jobs/Data-Engineer-ad8ee651632e14aa?fccid=4ed03476a1620afb&vjs=3
Automation Testing Engineer,Data Engineer,Impetus Infotech India Pvt. Ltd.,"Temporarily Remote in Bengaluru, Karnataka",Our products and services are designed to empower the real-time data driven enterprise to help our clients win in the modern world of digital transformation.,PostedPosted 30+ days ago,"From ₹3,00,000 a year",2023-03-15,/pagead/clk?mo=r&ad=-6NYlbfkN0AGEVbZ2_EvqOrNbUUcdLvwezuoK2AEzvuLfn6UI04WCipH-fDPeMV5RkEJh0bkYz4YbVclcMIAO3dA527qWGRoJgFI2cuKv4myCelNsoRSxRdq1cn9S5lGG4BE5CXHJIfVEICt2anW-LK3cEcfux7nmKgqrG733PFVEuUYfXciHQmTMWC5uXq2F2nOsCKYBvtpUTzloeruuFngdtXFSSLchqmMmvvwUERb84ACmfUWidyipmvfNPj0ayEAu3wJUXbakKtYPzVZJTOO-xxWqM_jXNm74b9tRIlFdX8_xVfuW_328sLCRE95N_ubyQITmCFujcDFrncqkOgzKH0P-EndYKjmKQzojosR9gGc-QNJ-9Qmd8lIzr_wasG_moW_6CjJaezU_e9ayo2LHAqkTesZNKZvfCmZvDYqS5Kmil5hPdPk7P3MB40ta9iXbEOvA8v1fKXbHQxeOfodV6UgmYs5byWsfHO9nF5oczqhrOAj59mQ669DGqmcaNW0kkQXrlCwgpXAylU6n5MA34F4z6UXhdTUClvL7PSuRz47QO1H7Q==&xkcb=SoDD-_M3SyqpiNSS8Z0LbzkdCdPP&p=13&fvj=1&vjs=3
Azure data engineer- remote,Data Engineer,3Minds eSolutions Pvt Ltd,"Remote in Bengaluru, Karnataka","3+ years exp in Azure data engineer.
Should be able to analyse and understand complex data.
Role: *Azure Data Engineer-Data Factory with , Data Lake*.",EmployerActive 5 days ago,"From ₹7,00,000 a year",2023-03-15,/company/3Minds-eSolutions-Pvt-Ltd/jobs/Azure-Data-Engineer-cf8f47b2eb467419?fccid=d215d5e8b1695979&vjs=3
Data engineer Intern,Data Engineer,Truthics Solutions,"Delhi, Delhi","Creating API integrations to extract data from Social Media and CRM APIs using Python 2.
Creating automation using Python 3.",PostedPosted 15 days ago,?,2023-03-15,/rc/clk?jk=bed136509b2844a5&fccid=e10cd4e3f3c7610d&vjs=3
BI Data Engineer,Data Engineer,RFOX Labs,Remote,"Work with various stakeholders to build the necessary data pipelines and get them the data they need.
Have experience dealing with Blockchain data.",PostedPosted 30+ days ago,?,2023-03-15,/rc/clk?jk=b9d924eb2f4d3806&fccid=7a997587c9476798&vjs=3
Data Engineer,Data Engineer,Amicus Technology,"Raipur, Chhattisgarh","4+ years of relevant experience.
You will understand requirements, create, and review designs, validate the architecture and ensure high levels of service…",PostedPosted 13 days ago,?,2023-03-15,/rc/clk?jk=b3b850b6d762568c&fccid=81b37c42fd6e317d&vjs=3
Senior Data Engineer,Data Engineer,Mercedes-Benz Research and Development India...,"Bengaluru, Karnataka","Collaborating with data scientists, data analysts, and other stakeholders to understand their data needs and identify opportunities to leverage data to solve…",PostedPosted 30+ days ago,?,2023-03-15,/rc/clk?jk=a377911608fd4fa0&fccid=9ab138c02aaca829&vjs=3
Azure Data Engineer,Data Engineer,Kiash Solutions LLP,"Bengaluru, Karnataka","Cloud data engineer who is an expert in technology, should be able to quickly adopt to change and one who understands the technologies supporting areas such as…",PostedPosted 28 days ago,"₹7,96,048 - ₹19,45,788 a year",2023-03-15,/company/Kiash-Solutions-LLP/jobs/Azure-Data-Engineer-1627ecb6fac39fa6?fccid=9221aa86f92cd558&vjs=3
Data Engineer - 1,Data Engineer,Bizongo,"Remote in Bengaluru, Karnataka","> Experience building and optimizing data pipelines, architectures and data sets.
> Work with data and analytics experts to strive for greater functionality in…",EmployerActive 4 days ago,"Up to ₹13,00,000 a year",2023-03-15,/company/Bizongo/jobs/Data-Engineer-536dbeadcbbfb0d0?fccid=4232979cb0926d4d&vjs=3
